{
  "walletAddress": "0x1234567890123456789012345678901234567890",
  "lastUpdated": "2025-10-20T12:00:00.000Z",
  "questProgress": {
    "blockchain-basics": {
      "questStatus": "in-progress",
      "currentChallengeIndex": 2,
      "totalChallenges": 10,
      "completedChallenges": [0, 1],
      "attemptedQuestions": [
        {
          "challengeIndex": 0,
          "questionId": "blockchain-basics-challenge-0-question-core",
          "attempts": 1,
          "lastAttempt": "2025-10-20T11:45:00.000Z",
          "isCorrect": true,
          "userAnswers": ["Block"],
          "correctAnswers": ["Block", "Transaction"]
        },
        {
          "challengeIndex": 0,
          "questionId": "blockchain-basics-challenge-0-question-features",
          "attempts": 1,
          "lastAttempt": "2025-10-20T11:46:00.000Z",
          "isCorrect": true,
          "userAnswers": ["Hash"],
          "correctAnswers": ["Hash"]
        },
        {
          "challengeIndex": 1,
          "questionId": "blockchain-basics-challenge-1-question-core",
          "attempts": 2,
          "lastAttempt": "2025-10-20T11:50:00.000Z",
          "isCorrect": true,
          "userAnswers": ["Wrong Answer", "Cryptography"],
          "correctAnswers": ["Cryptography", "Decentralization"]
        }
      ]
    },
    "crypto-security": {
      "questStatus": "not-started",
      "currentChallengeIndex": 0,
      "totalChallenges": 50,
      "completedChallenges": [],
      "attemptedQuestions": []
    }
  },
  "overallStats": {
    "totalQuestionsAttempted": 4,
    "totalQuestionsCorrect": 3,
    "accuracyRate": 75.0,
    "totalPlayTime": 900,
    "lastPlaySession": "2025-10-20T12:00:00.000Z"
  }
}